{
  "catalog_version": "1.0.0",
  "categories": [
    {
      "id": "app_launch",
      "label": "Applications",
      "planner_note": "uniquement les applications de l'allowlist du PC (jamais de shell ni d'hôte de script)"
    },
    {
      "id": "keyboard",
      "label": "Clavier",
      "planner_note": "agit sur la fenêtre au premier plan : précise window_title quand c'est possible"
    },
    {
      "id": "generic",
      "label": "Attente",
      "planner_note": "interruptible par un arrêt"
    },
    {
      "id": "screen",
      "label": "Écran",
      "planner_note": "la capture est jointe au rapport : l'évaluateur VOIT le résultat"
    },
    {
      "id": "mouse",
      "label": "Souris",
      "planner_note": "coordonnées en pixels de l'écran"
    },
    {
      "id": "window",
      "label": "Fenêtres",
      "planner_note": "plusieurs fenêtres correspondantes = refus : donne un titre précis"
    },
    {
      "id": "filesystem",
      "label": "Fichiers",
      "planner_note": "chemins absolus, restreints aux dossiers autorisés du PC"
    },
    {
      "id": "shell",
      "label": "Commandes de développement",
      "planner_note": "programmes en allowlist, exécutés SANS shell, toujours confirmés sur le PC"
    },
    {
      "id": "phone",
      "label": "Téléphone Android",
      "planner_note": "adb + appareil connecté ; commence TOUJOURS par phone_list_devices ; iOS non supporté"
    },
    {
      "id": "video",
      "label": "Démonstrations vidéo",
      "planner_note": "chemins dans les dossiers autorisés"
    },
    {
      "id": "git",
      "label": "Dépôts git (worktrees)",
      "planner_note": "une worktree et une branche soulbah/<session>/<tâche> par tâche ; fusion vers soulbah/<session>/integration seulement, tests verts exigés ; suppression et push = L3"
    },
    {
      "id": "voice",
      "label": "Voix (locale)",
      "planner_note": "synthèse vocale par les voix installées sur le PC (hors ligne) ; texte court et clair"
    },
    {
      "id": "web",
      "label": "Web (lecture)",
      "planner_note": "lecture seule, http/https publics ; cite l'URL lue (preuve http_status + sha256)"
    }
  ],
  "common_fields": [
    "description",
    "note",
    "type"
  ],
  "generated_from": "agent/skills/manifests.py",
  "security_levels": {
    "L0": "lecture sans effet (fichiers du workspace, appareils connectés, attente) — automatique",
    "L1": "réversible et confiné au workspace (écriture, captures, enregistrements, montage simple) — automatique après approbation de la session",
    "L2": "effet réel (souris, clavier, fenêtres, applications, téléphone, commandes, logiciels tiers) — grant de session ou approbation par action avec le contenu complet",
    "L3": "irréversible (suppression, scripts d'installation, secrets, promotion) — approbation par action, payload complet, jamais en lot"
  },
  "tools": [
    {
      "aliases": [],
      "category": "web",
      "description": "Lit une page web publique (http/https) : statut, URL finale, titre, sha256 du contenu, extrait de texte. engine=browser : Chromium sans interface (Playwright) pour les pages JavaScript. Adresses privées ou locales refusées.",
      "evidence": [
        {
          "confidence": "high",
          "description": "Statut HTTP et URL lue.",
          "field": "http",
          "kind": "http_status"
        },
        {
          "confidence": "high",
          "description": "Empreinte du contenu reçu.",
          "field": "sha256",
          "kind": "sha256"
        },
        {
          "confidence": "low",
          "description": "Extrait du texte visible (2000 caractères au plus).",
          "field": "excerpt",
          "kind": "command_output"
        }
      ],
      "examples": [
        {
          "type": "browser_get",
          "url": "https://example.com/"
        }
      ],
      "idempotent": true,
      "known_errors": [
        "schéma refusé (http ou https seulement)",
        "adresse non publique refusée",
        "page trop volumineuse",
        "Playwright n'est pas installé"
      ],
      "name": "browser_get",
      "params": [
        {
          "deprecated": false,
          "description": "URL http(s) à lire.",
          "is_path": false,
          "is_secret_text": false,
          "max_length": 2000,
          "name": "url",
          "required": true,
          "type": "string"
        },
        {
          "default": "auto",
          "deprecated": false,
          "description": "auto (HTTP simple), http ou browser.",
          "enum": [
            "auto",
            "http",
            "browser"
          ],
          "is_path": false,
          "is_secret_text": false,
          "name": "engine",
          "required": false,
          "type": "string"
        },
        {
          "default": 20,
          "deprecated": false,
          "description": "Délai en secondes.",
          "is_path": false,
          "is_secret_text": false,
          "max": 60,
          "min": 1,
          "name": "timeout",
          "required": false,
          "type": "number"
        }
      ],
      "required_any": [],
      "requires_confirmation": false,
      "requires_desktop_input": false,
      "security_level": "L1",
      "timeout_s": 90,
      "version": "1.0.0"
    },
    {
      "aliases": [
        "mouse"
      ],
      "category": "mouse",
      "description": "Clic de souris en (x, y), ou à la position actuelle sans x/y.",
      "evidence": [
        {
          "confidence": "none",
          "description": "Aucune preuve : seul le compte rendu de l'agent (vérifier par une capture).",
          "kind": "self_report"
        }
      ],
      "examples": [
        {
          "type": "click",
          "x": 640,
          "y": 360
        },
        {
          "button": "left",
          "clicks": 1,
          "type": "click",
          "x": 100,
          "y": 200
        }
      ],
      "idempotent": false,
      "known_errors": [
        "champs 'x' et 'y' : les deux ou aucun",
        "coordonnées hors bornes",
        "contrôle d'entrée non pré-autorisé : confirmation exigée sur le PC"
      ],
      "name": "click",
      "params": [
        {
          "deprecated": false,
          "description": "Abscisse en pixels (avec y ; sans x/y : position actuelle du curseur).",
          "is_path": false,
          "is_secret_text": false,
          "max": 100000,
          "min": -100000,
          "name": "x",
          "required": false,
          "type": "number"
        },
        {
          "deprecated": false,
          "description": "Ordonnée en pixels (avec x).",
          "is_path": false,
          "is_secret_text": false,
          "max": 100000,
          "min": -100000,
          "name": "y",
          "required": false,
          "type": "number"
        },
        {
          "default": "left",
          "deprecated": false,
          "description": "Bouton de la souris.",
          "enum": [
            "left",
            "right",
            "middle"
          ],
          "is_path": false,
          "is_secret_text": false,
          "name": "button",
          "required": false,
          "type": "string"
        },
        {
          "default": 1,
          "deprecated": false,
          "description": "Nombre de clics.",
          "is_path": false,
          "is_secret_text": false,
          "max": 3,
          "min": 1,
          "name": "clicks",
          "required": false,
          "type": "integer"
        }
      ],
      "required_any": [],
      "requires_confirmation": false,
      "requires_desktop_input": true,
      "security_level": "L2",
      "timeout_s": null,
      "version": "1.0.0"
    },
    {
      "aliases": [],
      "category": "mouse",
      "description": "Double-clic en (x, y), ou à la position actuelle sans x/y.",
      "evidence": [
        {
          "confidence": "none",
          "description": "Aucune preuve : seul le compte rendu de l'agent (vérifier par une capture).",
          "kind": "self_report"
        }
      ],
      "examples": [
        {
          "type": "double_click",
          "x": 200,
          "y": 150
        }
      ],
      "idempotent": false,
      "known_errors": [
        "champs 'x' et 'y' : les deux ou aucun",
        "contrôle d'entrée non pré-autorisé : confirmation exigée sur le PC"
      ],
      "name": "double_click",
      "params": [
        {
          "deprecated": false,
          "description": "Abscisse en pixels (avec y ; sans x/y : position actuelle du curseur).",
          "is_path": false,
          "is_secret_text": false,
          "max": 100000,
          "min": -100000,
          "name": "x",
          "required": false,
          "type": "number"
        },
        {
          "deprecated": false,
          "description": "Ordonnée en pixels (avec x).",
          "is_path": false,
          "is_secret_text": false,
          "max": 100000,
          "min": -100000,
          "name": "y",
          "required": false,
          "type": "number"
        },
        {
          "default": "left",
          "deprecated": false,
          "description": "Bouton de la souris.",
          "enum": [
            "left",
            "right",
            "middle"
          ],
          "is_path": false,
          "is_secret_text": false,
          "name": "button",
          "required": false,
          "type": "string"
        }
      ],
      "required_any": [],
      "requires_confirmation": false,
      "requires_desktop_input": true,
      "security_level": "L2",
      "timeout_s": null,
      "version": "1.0.0"
    },
    {
      "aliases": [],
      "category": "mouse",
      "description": "Glisse (bouton gauche maintenu) de la position actuelle jusqu'à (x, y).",
      "evidence": [
        {
          "confidence": "none",
          "description": "Aucune preuve : seul le compte rendu de l'agent (vérifier par une capture).",